2017-06-15 17:30:05|http://www.books.com.tw/3964.html|Mozilla/5.0 (Windows NT 5.0; rv:21.0) Gecko/20100101 Firefox/21.0|6a9bfda3-f093-47d8-8707-c7792cc062b9
2017-06-15 17:30:05|http://www.books.com.tw/10491.html|Mozilla/5.0 (Windows; U; Windows NT 6.0; en-US) AppleWebKit/533.20.25 (KHTML, like Gecko) Version/5.0.4 Safari/533.20.27|1299ee24-28b7-11e7-93ae-92361f002671
2017-06-15 17:30:05|http://www.books.com.tw/1000.html|Mozilla/5.0 (Linux; U; Android 4.0.3; ko-kr; LG-L160L Build/IML74K) AppleWebkit/534.30 (KHTML, like Gecko) Version/4.0 Mobile Safari/534.30|1299fbb2-28b7-11e7-93ae-92361f002671
2017-06-15 17:30:05|http://www.books.com.tw/5520.html|Mozilla/5.0 (compatible; MSIE 9.0; Windows NT 6.1; Trident/5.0)|12997408-28b7-11e7-93ae-92361f002671
2017-06-15 17:30:05|http://www.books.com.tw/12535.html|Mozilla/5.0 (Macintosh; U; Intel Mac OS X 10_6_6; it-it) AppleWebKit/533.20.25 (KHTML, like Gecko) Version/5.0.4 Safari/533.20.27|8a183979-b25d-4151-be11-a946d1000340
2017-06-15 17:30:05|http://www.books.com.tw/13496.html|Mozilla/5.0 (Linux; U; Android 2.3.3; zh-tw; HTC_Pyramid Build/GRI40) AppleWebKit/533.1 (KHTML, like Gecko) Version/4.0 Mobile Safari|677de48f-f87b-4597-a4e3-172929e7ea45
