2017-06-23 17:30:08|http://www.books.com.tw/630.html|Mozilla/5.0 (Linux; U; Android 2.2.1; en-gb; HTC_DesireZ_A7272 Build/FRG83D) AppleWebKit/533.1 (KHTML, like Gecko) Version/4.0 Mobile Safari/533.1|1299e05a-28b7-11e7-93ae-92361f002671
2017-06-23 17:30:08|http://www.books.com.tw/847.html|Mozilla/5.0 (Windows NT 5.0; rv:21.0) Gecko/20100101 Firefox/21.0|b9242eb6-74ca-433c-b776-203f2134fdac
2017-06-23 17:30:08|http://www.books.com.tw/9549.html|Mozilla/5.0 (Windows NT 6.2; rv:21.0) Gecko/20130326 Firefox/21.0|1298ff28-28b7-11e7-93ae-92361f002671
2017-06-23 17:30:08|http://www.books.com.tw/1443.html|Mozilla/5.0 (Linux; U; Android 2.3.5; en-us; HTC Vision Build/GRI40) AppleWebKit/533.1 (KHTML, like Gecko) Version/4.0 Mobile Safari/533.1|83662ad8-4ef0-4d48-9bf0-1e6550f26ef3
2017-06-23 17:30:08|http://www.books.com.tw/6679.html|Mozilla/5.0 (Macintosh; U; Intel Mac OS X 10_6_6; ko-kr) AppleWebKit/533.20.25 (KHTML, like Gecko) Version/5.0.4 Safari/533.20.27|c9de8f25-3e30-4237-a19d-ba88b4d8a741
2017-06-23 17:30:08|http://www.books.com.tw/9513.html|Mozilla/5.0 (Windows NT 6.3; rv:36.0) Gecko/20100101 Firefox/36.0|d054262c-aafd-4765-9f3d-fbef80c3d6ab
2017-06-23 17:30:08|http://www.books.com.tw/6466.html|Mozilla/5.0 (Linux; U; Android 2.3.3; en-us; HTC_DesireS_S510e Build/GRI40) AppleWebKit/533.1 (KHTML, like Gecko) Version/4.0 Mobile Safari/533.1|e94dfb25-d043-4850-8811-beeb55ee71c2
2017-06-23 17:30:08|http://www.books.com.tw/5738.html|Mozilla/5.0 (Windows; U; Windows NT 6.0; ja-JP) AppleWebKit/533.20.25 (KHTML, like Gecko) Version/5.0.4 Safari/533.20.27|12991580-28b7-11e7-93ae-92361f002671
2017-06-23 17:30:08|http://www.books.com.tw/14077.html|Mozilla/5.0 (Macintosh; Intel Mac OS X 10_10; rv:33.0) Gecko/20100101 Firefox/33.0|da7045eb-eac1-4656-9937-d47f055427ec
