2017-06-25 17:30:07|http://www.books.com.tw/4691.html|Mozilla/5.0 (Macintosh; U; Intel Mac OS X 10_6_6; de-de) AppleWebKit/533.20.25 (KHTML, like Gecko) Version/5.0.4 Safari/533.20.27|2f056bb6-361a-44a7-bce1-8c109e3516e1
2017-06-25 17:30:07|http://www.books.com.tw/2796.html|Mozilla/5.0 (Linux; U; Android 2.2; en-sa; HTC_DesireHD_A9191 Build/FRF91) AppleWebKit/533.1 (KHTML, like Gecko) Version/4.0 Mobile Safari/533.1|52082c5e-6997-41a3-b8a5-c635f39186df
2017-06-25 17:30:07|http://www.books.com.tw/12796.html|Mozilla/5.0 (Windows NT 6.1; WOW64; rv:40.0) Gecko/20100101 Firefox/40.1|bec36a34-4f75-470e-80ee-d3132d77382a
2017-06-25 17:30:07|http://www.books.com.tw/4363.html|Mozilla/5.0 (Windows; U; Windows NT 6.1; tr-TR) AppleWebKit/533.20.25 (KHTML, like Gecko) Version/5.0.4 Safari/533.20.27|1298eca4-28b7-11e7-93ae-92361f002671
2017-06-25 17:30:07|http://www.books.com.tw/12868.html|Mozilla/5.0 (Macintosh; U; Intel Mac OS X 10_6_6; ja-jp) AppleWebKit/533.20.25 (KHTML, like Gecko) Version/5.0.4 Safari/533.20.27|e94092de-86bc-4e78-b16e-f03a5d47df3d
2017-06-25 17:30:07|http://www.books.com.tw/9538.html|Mozilla/5.0 (Macintosh; U; Intel Mac OS X 10_6_6; it-it) AppleWebKit/533.20.25 (KHTML, like Gecko) Version/5.0.4 Safari/533.20.27|8a707413-048c-4053-9cad-c92c168d7a15
2017-06-25 17:30:07|http://www.books.com.tw/5773.html|Mozilla/5.0 (Windows NT 6.1; rv:21.0) Gecko/20130328 Firefox/21.0|6fc6767d-843b-4667-9cfe-3e190ea4554d
2017-06-25 17:30:07|http://www.books.com.tw/13925.html|Mozilla/5.0 (X11; Ubuntu; Linux x86_64; rv:21.0) Gecko/20130331 Firefox/21.0|afe1c3be-9606-44d9-8676-700ae65c3c59
2017-06-25 17:30:07|http://www.books.com.tw/9823.html|Mozilla/5.0 (Linux; U; Android 2.3.3; zh-tw; HTC Pyramid Build/GRI40) AppleWebKit/533.1 (KHTML, like Gecko) Version/4.0 Mobile Safari/533.1|1298db74-28b7-11e7-93ae-92361f002671
