2017-06-26 17:30:01|http://www.books.com.tw/5533.html|Mozilla/5.0 (Macintosh; U; Intel Mac OS X 10_6_6; sv-se) AppleWebKit/533.20.25 (KHTML, like Gecko) Version/5.0.4 Safari/533.20.27|1298f406-28b7-11e7-93ae-92361f002671
2017-06-26 17:30:01|http://www.books.com.tw/11151.html|Mozilla/5.0 (X11; Ubuntu; Linux x86_64; rv:21.0) Gecko/20130331 Firefox/21.0|129a7df8-28b7-11e7-93ae-92361f002671
2017-06-26 17:30:01|http://www.books.com.tw/13140.html|Mozilla/5.0 (Windows NT 10.0; Win64; x64) AppleWebKit/537.36 (KHTML, like Gecko) Chrome/51.0.2704.79 Safari/537.36 Edge/14.14393|dcc005d3-3a54-4ef0-8252-b921ca6c4666
2017-06-26 17:30:01|http://www.books.com.tw/4668.html|Mozilla/5.0 (Windows; U; Windows NT 6.1; cs-CZ) AppleWebKit/533.20.25 (KHTML, like Gecko) Version/5.0.4 Safari/533.20.27|9b1fc809-2060-446a-8ffd-f7f33be0fde0
2017-06-26 17:30:01|http://www.books.com.tw/4290.html|Mozilla/5.0 (Windows NT 5.1; rv:21.0) Gecko/20100101 Firefox/21.0|92f75d4c-9073-4bae-a231-b5d07e12f2e4
2017-06-26 17:30:01|http://www.books.com.tw/3506.html|Mozilla/5.0 (Macintosh; U; Intel Mac OS X 10_6_6; ja-jp) AppleWebKit/533.20.25 (KHTML, like Gecko) Version/5.0.4 Safari/533.20.27|e4cc82d7-4d5c-40bc-bbab-d5f0179d62f7
2017-06-26 17:30:01|http://www.books.com.tw/1115.html|Mozilla/5.0 (Macintosh; U; Intel Mac OS X 10_6_6; sv-se) AppleWebKit/533.20.25 (KHTML, like Gecko) Version/5.0.4 Safari/533.20.27|04c3fca9-ffa5-44ea-a1ee-f3b46476a7e7
2017-06-26 17:30:01|http://www.books.com.tw/14288.html|Mozilla/5.0 (Macintosh; Intel Mac OS X 10_10; rv:33.0) Gecko/20100101 Firefox/33.0|1298fcc6-28b7-11e7-93ae-92361f002671
