2017-06-04 17:30:03|http://www.books.com.tw/1068.html|Mozilla/5.0 (Macintosh; U; PPC Mac OS X 10_5_8; zh-cn) AppleWebKit/533.20.25 (KHTML, like Gecko) Version/5.0.4 Safari/533.20.27|40a03392-1e0c-4c4d-8e47-1f71305cc1cd
2017-06-04 17:30:03|http://www.books.com.tw/6044.html|Mozilla/5.0 (Linux; U; Android 2.3.4; fr-fr; HTC Desire Build/GRJ22) AppleWebKit/533.1 (KHTML, like Gecko) Version/4.0 Mobile Safari/533.1|1298823c-28b7-11e7-93ae-92361f002671
2017-06-04 17:30:03|http://www.books.com.tw/13833.html|Mozilla/5.0 (Linux; U; Android 2.3.3; zh-tw; HTC Pyramid Build/GRI40) AppleWebKit/533.1 (KHTML, like Gecko) Version/4.0 Mobile Safari/533.1|537f8e45-31f9-460f-b605-5b856bad6c24
2017-06-04 17:30:03|http://www.books.com.tw/12782.html|Mozilla/5.0 (Windows NT 6.1; WOW64; rv:21.0) Gecko/20130331 Firefox/21.0|4b0e7705-15ad-46b4-83d3-4c31861109e6
2017-06-04 17:30:03|http://www.books.com.tw/255.html|Mozilla/5.0 (Macintosh; U; PPC Mac OS X 10_5_8; zh-cn) AppleWebKit/533.20.25 (KHTML, like Gecko) Version/5.0.4 Safari/533.20.27|57ee3fb7-dcd7-454e-b478-1aa01e0d18ef
2017-06-04 17:30:03|http://www.books.com.tw/13363.html|Mozilla/5.0 (X11; Ubuntu; Linux x86_64; rv:21.0) Gecko/20100101 Firefox/21.0|da046486-6bac-43cc-afd4-d3a2afcf5f47
