2017-06-24 17:30:03|http://www.books.com.tw/12449.html|Mozilla/5.0 (Macintosh; U; Intel Mac OS X 10_6_6; ko-kr) AppleWebKit/533.20.25 (KHTML, like Gecko) Version/5.0.4 Safari/533.20.27|cc9fad4e-2f9e-4186-9bf2-d1a262393348
2017-06-24 17:30:03|http://www.books.com.tw/15593.html|Mozilla/5.0 (Windows NT 6.2; rv:21.0) Gecko/20130326 Firefox/21.0|02bd570f-020e-4bc4-9c5a-ea90a0560e9a
2017-06-24 17:30:03|http://www.books.com.tw/11970.html|Mozilla/5.0 (Linux; U; Android 2.3.3; zh-tw; HTC Pyramid Build/GRI40) AppleWebKit/533.1 (KHTML, like Gecko) Version/4.0 Mobile Safari/533.1|2fc9c950-7f1f-48b5-a7ad-b39573872375
2017-06-24 17:30:03|http://www.books.com.tw/597.html|Mozilla/5.0 (Linux; U; Android 2.3.3; zh-tw; HTC_Pyramid Build/GRI40) AppleWebKit/533.1 (KHTML, like Gecko) Version/4.0 Mobile Safari|9b1fc809-2060-446a-8ffd-f7f33be0fde0
2017-06-24 17:30:03|http://www.books.com.tw/12924.html|Mozilla/5.0 (Windows NT 5.1; rv:21.0) Gecko/20100101 Firefox/21.0|129a222c-28b7-11e7-93ae-92361f002671
2017-06-24 17:30:03|http://www.books.com.tw/4860.html|Mozilla/5.0 (Macintosh; U; Intel Mac OS X 10_6_6; zh-cn) AppleWebKit/533.20.25 (KHTML, like Gecko) Version/5.0.4 Safari/533.20.27|d4f8a88f-51a8-4335-924a-572844770125
