2017-06-28 17:30:07|http://www.books.com.tw/8855.html|Mozilla/5.0 (Windows; U; Windows NT 6.1; fr-FR) AppleWebKit/533.20.25 (KHTML, like Gecko) Version/5.0.4 Safari/533.20.27|46f9115a-e7e8-494b-9fcb-1cfb300a5cf1
2017-06-28 17:30:07|http://www.books.com.tw/13530.html|Mozilla/5.0 (Macintosh; U; Intel Mac OS X 10_6_6; it-it) AppleWebKit/533.20.25 (KHTML, like Gecko) Version/5.0.4 Safari/533.20.27|12999d66-28b7-11e7-93ae-92361f002671
2017-06-28 17:30:07|http://www.books.com.tw/11510.html|Mozilla/5.0 (Linux; U; Android 2.3.3; zh-tw; HTC Pyramid Build/GRI40) AppleWebKit/533.1 (KHTML, like Gecko) Version/4.0 Mobile Safari/533.1|96aa9337-327e-4ec2-a1d2-77e8f610d694
2017-06-28 17:30:07|http://www.books.com.tw/11099.html|Mozilla/5.0 (X11; Ubuntu; Linux x86_64; rv:21.0) Gecko/20100101 Firefox/21.0|1299947e-28b7-11e7-93ae-92361f002671
2017-06-28 17:30:07|http://www.books.com.tw/9499.html|Mozilla/5.0 (Macintosh; U; Intel Mac OS X 10_6_6; ko-kr) AppleWebKit/533.20.25 (KHTML, like Gecko) Version/5.0.4 Safari/533.20.27|36c50496-91db-4492-9940-207ce6bf34f1
2017-06-28 17:30:07|http://www.books.com.tw/1803.html|Mozilla/5.0 (X11; Linux i686; rv:21.0) Gecko/20100101 Firefox/21.0|12990bc6-28b7-11e7-93ae-92361f002671
2017-06-28 17:30:07|http://www.books.com.tw/6506.html|Mozilla/5.0 (Windows; U; Windows NT 6.1; en-US) AppleWebKit/533.20.25 (KHTML, like Gecko) Version/5.0.4 Safari/533.20.27|3b64ee15-5d6c-4c64-a9a1-13797e3ac62a
2017-06-28 17:30:07|http://www.books.com.tw/10128.html|Mozilla/5.0 (Windows NT 6.1; rv:21.0) Gecko/20100101 Firefox/21.0|129a3c6c-28b7-11e7-93ae-92361f002671
2017-06-28 17:30:07|http://www.books.com.tw/3606.html|Mozilla/5.0 (Windows NT 6.1; WOW64; rv:21.0) Gecko/20130331 Firefox/21.0|12989fc4-28b7-11e7-93ae-92361f002671
