2017-06-03 17:30:13|http://www.books.com.tw/4801.html|Mozilla/5.0 (Macintosh; Intel Mac OS X 10.8; rv:21.0) Gecko/20100101 Firefox/21.0|8f696361-de49-4bfe-9191-748228b7c3f9
2017-06-03 17:30:13|http://www.books.com.tw/8858.html|Mozilla/5.0 (Macintosh; U; Intel Mac OS X 10_6_6; sv-se) AppleWebKit/533.20.25 (KHTML, like Gecko) Version/5.0.4 Safari/533.20.27|2478f521-a236-4e3a-939d-bf53b9f1ac43
2017-06-03 17:30:13|http://www.books.com.tw/5119.html|Mozilla/5.0 (Windows NT 5.0; rv:21.0) Gecko/20100101 Firefox/21.0|129a93ba-28b7-11e7-93ae-92361f002671
2017-06-03 17:30:13|http://www.books.com.tw/12915.html|Mozilla/5.0 (Windows NT 6.1; WOW64; rv:21.0) Gecko/20130401 Firefox/21.0|ed8e0c8d-b75e-481a-a72e-9250e195373b
2017-06-03 17:30:13|http://www.books.com.tw/8347.html|Mozilla/5.0 (Macintosh; Intel Mac OS X 10.8; rv:21.0) Gecko/20100101 Firefox/21.0|fb429fe4-9b79-4201-a41b-4715eb96871e
2017-06-03 17:30:13|http://www.books.com.tw/14984.html|Mozilla/5.0 (Linux; U; Android 2.3; en-us) AppleWebKit/999+ (KHTML, like Gecko) Safari/999.9|588d4c25-2d01-42ed-83d9-af0c61065d11
2017-06-03 17:30:13|http://www.books.com.tw/4160.html|Mozilla/5.0 (Macintosh; U; Intel Mac OS X 10_6_7; ja-jp) AppleWebKit/533.20.25 (KHTML, like Gecko) Version/5.0.4 Safari/533.20.27|99da78b9-af39-406a-aedf-e3666a4f8ceb
2017-06-03 17:30:13|http://www.books.com.tw/7283.html|Mozilla/5.0 (Linux; U; Android 2.3.3; zh-tw; HTC_Pyramid Build/GRI40) AppleWebKit/533.1 (KHTML, like Gecko) Version/4.0 Mobile Safari/533.1|c3d0e4e5-9cee-4aa4-8029-4cbcdb9448f3
