2017-06-29 17:30:02|http://www.books.com.tw/13666.html|Mozilla/5.0 (Macintosh; U; Intel Mac OS X 10_6_6; ko-kr) AppleWebKit/533.20.25 (KHTML, like Gecko) Version/5.0.4 Safari/533.20.27|12998826-28b7-11e7-93ae-92361f002671
2017-06-29 17:30:02|http://www.books.com.tw/14562.html|Mozilla/5.0 (Macintosh; U; Intel Mac OS X 10_6_6; de-de) AppleWebKit/533.20.25 (KHTML, like Gecko) Version/5.0.4 Safari/533.20.27|bfc9a360-1f90-4bdf-bed8-e7f38722c380
2017-06-29 17:30:02|http://www.books.com.tw/855.html|Mozilla/5.0 (Linux; U; Android 2.3.3; en-us; HTC_DesireS_S510e Build/GRI40) AppleWebKit/533.1 (KHTML, like Gecko) Version/4.0 Mobile|129a47b6-28b7-11e7-93ae-92361f002671
2017-06-29 17:30:02|http://www.books.com.tw/974.html|Mozilla/5.0 (Windows; U; Windows NT 6.0; en-US) AppleWebKit/533.20.25 (KHTML, like Gecko) Version/5.0.4 Safari/533.20.27|12996c42-28b7-11e7-93ae-92361f002671
2017-06-29 17:30:02|http://www.books.com.tw/8832.html|Mozilla/5.0 (Macintosh; U; Intel Mac OS X 10_6_6; ja-jp) AppleWebKit/533.20.25 (KHTML, like Gecko) Version/5.0.4 Safari/533.20.27|1298ac26-28b7-11e7-93ae-92361f002671
2017-06-29 17:30:02|http://www.books.com.tw/13785.html|Mozilla/5.0 (Linux; U; Android 4.0.3; ko-kr; LG-L160L Build/IML74K) AppleWebkit/534.30 (KHTML, like Gecko) Version/4.0 Mobile Safari/534.30|1299392a-28b7-11e7-93ae-92361f002671
