2017-06-14 17:30:04|http://www.books.com.tw/4976.html|Mozilla/5.0 (Macintosh; U; Intel Mac OS X 10_6_6; en-gb) AppleWebKit/533.20.25 (KHTML, like Gecko) Version/5.0.4 Safari/533.20.27|458c4cdc-eda0-426c-9313-ea2aae878420
2017-06-14 17:30:04|http://www.books.com.tw/786.html|Mozilla/5.0 (Linux; U; Android 2.3.3; de-de; HTC Desire Build/GRI40) AppleWebKit/533.1 (KHTML, like Gecko) Version/4.0 Mobile Safari/533.1|30a781f9-8b73-4a7f-ae0e-0553f37134d6
2017-06-14 17:30:04|http://www.books.com.tw/7522.html|Mozilla/5.0 (Macintosh; U; PPC Mac OS X 10_5_8; ja-jp) AppleWebKit/533.20.25 (KHTML, like Gecko) Version/5.0.4 Safari/533.20.27|1299f57c-28b7-11e7-93ae-92361f002671
2017-06-14 17:30:04|http://www.books.com.tw/7016.html|Mozilla/5.0 (X11; Ubuntu; Linux x86_64; rv:21.0) Gecko/20100101 Firefox/21.0|1298925e-28b7-11e7-93ae-92361f002671
2017-06-14 17:30:04|http://www.books.com.tw/15105.html|Mozilla/5.0 (Macintosh; U; PPC Mac OS X 10_5_8; ja-jp) AppleWebKit/533.20.25 (KHTML, like Gecko) Version/5.0.4 Safari/533.20.27|12996684-28b7-11e7-93ae-92361f002671
2017-06-14 17:30:04|http://www.books.com.tw/12450.html|Mozilla/5.0 (Linux; U; Android 2.3.3; en-us; HTC_DesireS_S510e Build/GRI40) AppleWebKit/533.1 (KHTML, like Gecko) Version/4.0 Mobile Safari/533.1|f420ff23-d482-454a-95b6-1c81f9a97284
2017-06-14 17:30:04|http://www.books.com.tw/8206.html|Mozilla/5.0 (Windows NT 6.2; rv:21.0) Gecko/20130326 Firefox/21.0|12998aba-28b7-11e7-93ae-92361f002671
2017-06-14 17:30:04|http://www.books.com.tw/13492.html|Mozilla/5.0 (X11; Linux i686; rv:21.0) Gecko/20100101 Firefox/21.0|ff82d510-0348-4269-a8ad-a7ae60cb2bcd
